{
  "refreshedAt": "2026-10-01",
  "exportedAt": "2026-10-01T09:00:00-07:00",
  "source": "03_Team_Enablement/daily_tracker.xlsx · Daily",
  "tickets": [
    {
      "ticket": "APP-193",
      "owner": "Alan Le",
      "status": "In Progress",
      "tester": "Pavan V",
      "points": 2,
      "parent": "APP-189 – Monitor enhancements",
      "linkedWorkItems": "APP-2944",
      "fixVersion": "4.46",
      "summary": "Notification dropdown doesn't navigate correctly to the notification center.",
      "lastSyncUpdate": "Reviewed in the 9/30 daily as the ticket tied to Sync Pro; Alan to review Pavan's latest test comments.",
      "blocker": null,
      "demoOrSpike": null,
      "discussed": "Yes",
      "doneDate": null,
      "addedDate": null,
      "cycleTime": null
    },
    {
      "ticket": "APP-2631",
      "owner": "Salim Abdul",
      "status": "In Progress",
      "tester": null,
      "points": 5,
      "parent": "APP-55 – App Foundation PSWAT",
      "linkedWorkItems": null,
      "fixVersion": null,
      "summary": "Checkout from git fails with error indicating the branch is not found",
      "lastSyncUpdate": "New to sprint; not discussed in any daily yet.",
      "blocker": null,
      "demoOrSpike": null,
      "discussed": "No",
      "doneDate": null,
      "addedDate": "2026-09-27",
      "cycleTime": null
    },
    {
      "ticket": "APP-3053",
      "owner": "Unassigned",
      "status": "Blocked",
      "tester": null,
      "points": null,
      "parent": null,
      "linkedWorkItems": null,
      "fixVersion": null,
      "summary": "Internal Server Error during Git operations for a branch having ~1000 files.",
      "lastSyncUpdate": "Not discussed yet.",
      "blocker": "Needs investigation into repository size limits.",
      "demoOrSpike": null,
      "discussed": "No",
      "doneDate": null,
      "addedDate": null,
      "cycleTime": null
    },
    {
      "ticket": "APP-2944",
      "owner": "Artem Velykorodnyi",
      "status": "Done",
      "tester": null,
      "points": 2,
      "parent": null,
      "linkedWorkItems": null,
      "fixVersion": "4.46",
      "doneDate": "2026-09-28",
      "addedDate": null,
      "summary": "Example ticket finished mid-sprint, to show a populated Done Date.",
      "lastSyncUpdate": "Closed out after QA sign-off.",
      "blocker": null,
      "demoOrSpike": null,
      "discussed": "Yes",
      "cycleTime": 3
    }
  ],
  "sprint": {
    "id": 12119,
    "name": "APP Sprint 10-09-2026",
    "startDate": "2026-09-22",
    "endDate": "2026-10-09",
    "carriedOver": {
      "count": 12,
      "percent": 17.6,
      "storyPoints": 34
    }
  }
}
